{
  "sku_id": "rtx-4060-ti-16gb-asus",
  "component_id": "rtx-4060-ti-16gb",
  "display_name": "ASUS Dual GeForce RTX 4060 Ti EVO 16GB",
  "mpn": "DUAL-RTX4060TI-O16G-EVO",
  "tracked_urls": [
    { "retailer": "newegg", "url": "https://www.newegg.com/p/N82E16814126682" }
  ],
  "currency": "USD",
  "msrp": 499,
  "active": true,
  "created_at": "2026-06-22T15:00:00Z"
}
